<?xml version="1.0" encoding="utf-8"?>
<!-- Copyright 2016 The Android Open Source Project
     Licensed under the Apache License, Version 2.0 (the "License");
     you may not use this file except in compliance with the License.
     You may obtain a copy of the License at
          http://www.apache.org/licenses/LICENSE-2.0
     Unless required by applicable law or agreed to in writing, software
     distributed under the License is distributed on an "AS IS" BASIS,
     WITHOUT WARRANTIES OR CONDITIONS OF ANY KIND, either express or implied.
     See the License for the specific language governing permissions and
     limitations under the License.
-->
<!DOCTYPE MediaSettings [
<!ELEMENT MediaSettings (CamcorderProfiles,
                         EncoderOutputFileFormat+,
                         VideoEncoderCap+,
                         AudioEncoderCap+,
                         VideoDecoderCap,
                         AudioDecoderCap)>
<!ELEMENT CamcorderProfiles (EncoderProfile+, ImageEncoding+, ImageDecoding, Camera)>
<!ELEMENT EncoderProfile (Video, Audio)>
<!ATTLIST EncoderProfile quality (high|low) #REQUIRED>
<!ATTLIST EncoderProfile fileFormat (mp4|3gp) #REQUIRED>
<!ATTLIST EncoderProfile duration (30|60) #REQUIRED>
<!ATTLIST EncoderProfile cameraId (0|1|2|3|4|5|6|7) #REQUIRED>
<!ELEMENT Video EMPTY>
<!ATTLIST Video codec (h264|h263|m4v) #REQUIRED>
<!ATTLIST Video bitRate CDATA #REQUIRED>
<!ATTLIST Video width CDATA #REQUIRED>
<!ATTLIST Video height CDATA #REQUIRED>
<!ATTLIST Video frameRate CDATA #REQUIRED>
<!ELEMENT Audio EMPTY>
<!ATTLIST Audio codec (amrnb|amrwb|aac) #REQUIRED>
<!ATTLIST Audio bitRate CDATA #REQUIRED>
<!ATTLIST Audio sampleRate CDATA #REQUIRED>
<!ATTLIST Audio channels (1|2) #REQUIRED>
<!ELEMENT ImageEncoding EMPTY>
<!ATTLIST ImageEncoding quality (90|80|70|60|50|40) #REQUIRED>
<!ELEMENT ImageDecoding EMPTY>
<!ATTLIST ImageDecoding memCap CDATA #REQUIRED>
<!ELEMENT Camera EMPTY>
<!ELEMENT EncoderOutputFileFormat EMPTY>
<!ATTLIST EncoderOutputFileFormat name (mp4|3gp) #REQUIRED>
<!ELEMENT VideoEncoderCap EMPTY>
<!ATTLIST VideoEncoderCap name (hevc|h264|h263|m4v|wmv) #REQUIRED>
<!ATTLIST VideoEncoderCap enabled (true|false) #REQUIRED>
<!ATTLIST VideoEncoderCap minBitRate CDATA #REQUIRED>
<!ATTLIST VideoEncoderCap maxBitRate CDATA #REQUIRED>
<!ATTLIST VideoEncoderCap minFrameWidth CDATA #REQUIRED>
<!ATTLIST VideoEncoderCap maxFrameWidth CDATA #REQUIRED>
<!ATTLIST VideoEncoderCap minFrameHeight CDATA #REQUIRED>
<!ATTLIST VideoEncoderCap maxFrameHeight CDATA #REQUIRED>
<!ATTLIST VideoEncoderCap minFrameRate CDATA #REQUIRED>
<!ATTLIST VideoEncoderCap maxFrameRate CDATA #REQUIRED>
<!ELEMENT AudioEncoderCap EMPTY>
<!ATTLIST AudioEncoderCap name (amrnb|amrwb|aac|wma) #REQUIRED>
<!ATTLIST AudioEncoderCap enabled (true|false) #REQUIRED>
<!ATTLIST AudioEncoderCap minBitRate CDATA #REQUIRED>
<!ATTLIST AudioEncoderCap maxBitRate CDATA #REQUIRED>
<!ATTLIST AudioEncoderCap minSampleRate CDATA #REQUIRED>
<!ATTLIST AudioEncoderCap maxSampleRate CDATA #REQUIRED>
<!ATTLIST AudioEncoderCap minChannels (1|2) #REQUIRED>
<!ATTLIST AudioEncoderCap maxChannels (1|2) #REQUIRED>
<!ELEMENT VideoDecoderCap EMPTY>
<!ATTLIST VideoDecoderCap name (wmv) #REQUIRED>
<!ATTLIST VideoDecoderCap enabled (true|false) #REQUIRED>
<!ELEMENT AudioDecoderCap EMPTY>
<!ATTLIST AudioDecoderCap name (wma) #REQUIRED>
<!ATTLIST AudioDecoderCap enabled (true|false) #REQUIRED>
]>
<!--
     This file is used to declare the multimedia profiles and capabilities
     on an android-powered device.
-->
<MediaSettings>
    <!-- Each camcorder profile defines a set of predefined configuration parameters -->
    <CamcorderProfiles cameraId="0">
        <EncoderProfile quality="low" fileFormat="mp4" duration="30">
            <Video codec="h264"
                   bitRate="192000"
                   width="176"
                   height="144"
                   frameRate="20" />
            <Audio codec="aac"
                   bitRate="256000"
                   sampleRate="48000"
                   channels="2" />
        </EncoderProfile>
        <EncoderProfile quality="high" fileFormat="mp4" duration="30">
            <Video codec="h264"
                   bitRate="50000000"
                   width="3840"
                   height="2160"
                   frameRate="30" />
            <Audio codec="aac"
                   bitRate="256000"
                   sampleRate="48000"
                   channels="2" />
        </EncoderProfile>
        <EncoderProfile quality="qcif" fileFormat="mp4" duration="30">
            <Video codec="h264"
                   bitRate="192000"
                   width="176"
                   height="144"
                   frameRate="20" />
            <Audio codec="aac"
                   bitRate="256000"
                   sampleRate="48000"
                   channels="2" />
        </EncoderProfile>
        <EncoderProfile quality="qvga" fileFormat="mp4" duration="30">
            <Video codec="h264"
                   bitRate="1000000"
                   width="320"
                   height="240"
                   frameRate="30" />
            <Audio codec="aac"
                   bitRate="256000"
                   sampleRate="48000"
                   channels="2" />
        </EncoderProfile>
        <EncoderProfile quality="cif" fileFormat="mp4" duration="30">
            <Video codec="h264"
                   bitRate="1250000"
                   width="352"
                   height="288"
                   frameRate="30" />
            <Audio codec="aac"
                   bitRate="256000"
                   sampleRate="48000"
                   channels="2" />
        </EncoderProfile>
        <EncoderProfile quality="480p" fileFormat="mp4" duration="30">
            <Video codec="h264"
                   bitRate="4500000"
                   width="640"
                   height="480"
                   frameRate="30" />
            <Audio codec="aac"
                   bitRate="256000"
                   sampleRate="48000"
                   channels="2" />
        </EncoderProfile>
        <EncoderProfile quality="720p" fileFormat="mp4" duration="30">
            <Video codec="h264"
                   bitRate="9000000"
                   width="1280"
                   height="720"
                   frameRate="30" />
            <Audio codec="aac"
                   bitRate="256000"
                   sampleRate="48000"
                   channels="2" />
        </EncoderProfile>
        <EncoderProfile quality="1080p" fileFormat="mp4" duration="30">
            <Video codec="h264"
                   bitRate="20000000"
                   width="1920"
                   height="1080"
                   frameRate="30" />
            <Audio codec="aac"
                   bitRate="256000"
                   sampleRate="48000"
                   channels="2" />
        </EncoderProfile>
        <EncoderProfile quality="2160p" fileFormat="mp4" duration="30">
            <Video codec="h264"
                   bitRate="50000000"
                   width="3840"
                   height="2160"
                   frameRate="30" />
            <Audio codec="aac"
                   bitRate="256000"
                   sampleRate="48000"
                   channels="2" />
        </EncoderProfile>
        <EncoderProfile quality="timelapselow" fileFormat="mp4" duration="30">
            <Video codec="h264"
                   bitRate="1000000"
                   width="176"
                   height="144"
                   frameRate="20" />
            <Audio codec="aac"
                   bitRate="128000"
                   sampleRate="48000"
                   channels="2" />
        </EncoderProfile>
        <EncoderProfile quality="timelapsehigh" fileFormat="mp4" duration="30">
            <Video codec="h264"
                   bitRate="50000000"
                   width="3840"
                   height="2160"
                   frameRate="30" />
            <Audio codec="aac"
                   bitRate="256000"
                   sampleRate="48000"
                   channels="2" />
        </EncoderProfile>
        <EncoderProfile quality="timelapseqcif" fileFormat="mp4" duration="30">
            <Video codec="h264"
                   bitRate="1000000"
                   width="176"
                   height="144"
                   frameRate="20" />
            <Audio codec="aac"
                   bitRate="128000"
                   sampleRate="48000"
                   channels="2" />
        </EncoderProfile>
        <EncoderProfile quality="timelapseqvga" fileFormat="mp4" duration="30">
            <Video codec="h264"
                   bitRate="1000000"
                   width="320"
                   height="240"
                   frameRate="30" />
            <Audio codec="aac"
                   bitRate="256000"
                   sampleRate="48000"
                   channels="2" />
        </EncoderProfile>
        <EncoderProfile quality="timelapsecif" fileFormat="mp4" duration="30">
            <Video codec="h264"
                   bitRate="1250000"
                   width="352"
                   height="288"
                   frameRate="30" />
            <Audio codec="aac"
                   bitRate="256000"
                   sampleRate="48000"
                   channels="2" />
        </EncoderProfile>
        <EncoderProfile quality="timelapse480p" fileFormat="mp4" duration="30">
            <Video codec="h264"
                   bitRate="4500000"
                   width="640"
                   height="480"
                   frameRate="30" />
            <Audio codec="aac"
                   bitRate="256000"
                   sampleRate="48000"
                   channels="2" />
        </EncoderProfile>
        <EncoderProfile quality="timelapse720p" fileFormat="mp4" duration="30">
            <Video codec="h264"
                   bitRate="9000000"
                   width="1280"
                   height="720"
                   frameRate="30" />
            <Audio codec="aac"
                   bitRate="256000"
                   sampleRate="48000"
                   channels="2" />
        </EncoderProfile>
        <EncoderProfile quality="timelapse1080p" fileFormat="mp4" duration="30">
            <Video codec="h264"
                   bitRate="20000000"
                   width="1920"
                   height="1080"
                   frameRate="30" />
            <Audio codec="aac"
                   bitRate="256000"
                   sampleRate="48000"
                   channels="2" />
        </EncoderProfile>
        <EncoderProfile quality="timelapse2160p" fileFormat="mp4" duration="30">
            <Video codec="h264"
                   bitRate="50000000"
                   width="3840"
                   height="2160"
                   frameRate="30" />
            <Audio codec="aac"
                   bitRate="256000"
                   sampleRate="48000"
                   channels="2" />
        </EncoderProfile>
        <EncoderProfile quality="timelapsehigh" fileFormat="mp4" duration="30">
            <Video codec="h264"
                   bitRate="50000000"
                   width="3840"
                   height="2160"
                   frameRate="30" />
            <Audio codec="aac"
                   bitRate="256000"
                   sampleRate="48000"
                   channels="2" />
        </EncoderProfile>
        <EncoderProfile quality="highspeedlow" fileFormat="mp4" duration="30">
            <Video codec="h264"
                   bitRate="9000000"
                   width="1280"
                   height="720"
                   frameRate="120" />
            <Audio codec="aac"
                   bitRate="256000"
                   sampleRate="48000"
                   channels="2" />
        </EncoderProfile>
        <EncoderProfile quality="highspeed720p" fileFormat="mp4" duration="30">
            <Video codec="h264"
                   bitRate="9000000"
                   width="1280"
                   height="720"
                   frameRate="120" />
            <Audio codec="aac"
                   bitRate="256000"
                   sampleRate="48000"
                   channels="2" />
        </EncoderProfile>
        <EncoderProfile quality="highspeed1080p" fileFormat="mp4" duration="30">
            <Video codec="h264"
                   bitRate="17000000"
                   width="1920"
                   height="1080"
                   frameRate="240" />
            <Audio codec="aac"
                   bitRate="256000"
                   sampleRate="48000"
                   channels="2" />
        </EncoderProfile>
        <EncoderProfile quality="highspeedhigh" fileFormat="mp4" duration="30">
            <Video codec="h264"
                   bitRate="17000000"
                   width="1920"
                   height="1080"
                   frameRate="240" />
            <Audio codec="aac"
                   bitRate="256000"
                   sampleRate="48000"
                   channels="2" />
        </EncoderProfile>
        <ImageEncoding quality="95" />
        <ImageEncoding quality="80" />
        <ImageEncoding quality="70" />
        <ImageDecoding memCap="20000000" />
    </CamcorderProfiles>
    <CamcorderProfiles cameraId="1">
        <EncoderProfile quality="low" fileFormat="mp4" duration="30">
            <Video codec="h264"
                   bitRate="192000"
                   width="176"
                   height="144"
                   frameRate="20" />
            <Audio codec="aac"
                   bitRate="256000"
                   sampleRate="48000"
                   channels="2" />
        </EncoderProfile>
        <EncoderProfile quality="high" fileFormat="mp4" duration="30">
            <Video codec="h264"
                   bitRate="20000000"
                   width="1920"
                   height="1080"
                   frameRate="30" />
            <Audio codec="aac"
                   bitRate="256000"
                   sampleRate="48000"
                   channels="2" />
        </EncoderProfile>
        <EncoderProfile quality="qcif" fileFormat="mp4" duration="30">
            <Video codec="h264"
                   bitRate="192000"
                   width="176"
                   height="144"
                   frameRate="20" />
            <Audio codec="aac"
                   bitRate="256000"
                   sampleRate="48000"
                   channels="2" />
        </EncoderProfile>
        <EncoderProfile quality="qvga" fileFormat="mp4" duration="30">
            <Video codec="h264"
                   bitRate="1000000"
                   width="320"
                   height="240"
                   frameRate="30" />
            <Audio codec="aac"
                   bitRate="256000"
                   sampleRate="48000"
                   channels="2" />
        </EncoderProfile>
        <EncoderProfile quality="cif" fileFormat="mp4" duration="30">
            <Video codec="h264"
                   bitRate="1250000"
                   width="352"
                   height="288"
                   frameRate="30" />
            <Audio codec="aac"
                   bitRate="256000"
                   sampleRate="48000"
                   channels="2" />
        </EncoderProfile>
        <EncoderProfile quality="480p" fileFormat="mp4" duration="30">
            <Video codec="h264"
                   bitRate="4500000"
                   width="640"
                   height="480"
                   frameRate="30" />
            <Audio codec="aac"
                   bitRate="256000"
                   sampleRate="48000"
                   channels="2" />
        </EncoderProfile>
        <EncoderProfile quality="720p" fileFormat="mp4" duration="30">
            <Video codec="h264"
                   bitRate="9000000"
                   width="1280"
                   height="720"
                   frameRate="30" />
            <Audio codec="aac"
                   bitRate="256000"
                   sampleRate="48000"
                   channels="2" />
        </EncoderProfile>
        <EncoderProfile quality="1080p" fileFormat="mp4" duration="30">
            <Video codec="h264"
                   bitRate="20000000"
                   width="1920"
                   height="1080"
                   frameRate="30" />
            <Audio codec="aac"
                   bitRate="256000"
                   sampleRate="48000"
                   channels="2" />
        </EncoderProfile>
        <EncoderProfile quality="timelapselow" fileFormat="mp4" duration="30">
            <Video codec="h264"
                   bitRate="1000000"
                   width="176"
                   height="144"
                   frameRate="20" />
            <Audio codec="aac"
                   bitRate="128000"
                   sampleRate="48000"
                   channels="2" />
        </EncoderProfile>
        <EncoderProfile quality="timelapsehigh" fileFormat="mp4" duration="30">
            <Video codec="h264"
                   bitRate="35000000"
                   width="1920"
                   height="1080"
                   frameRate="30" />
            <Audio codec="aac"
                   bitRate="256000"
                   sampleRate="48000"
                   channels="2" />
        </EncoderProfile>
        <EncoderProfile quality="timelapseqcif" fileFormat="mp4" duration="30">
            <Video codec="h264"
                   bitRate="1000000"
                   width="176"
                   height="144"
                   frameRate="20" />
            <Audio codec="aac"
                   bitRate="128000"
                   sampleRate="48000"
                   channels="2" />
        </EncoderProfile>
        <EncoderProfile quality="timelapseqvga" fileFormat="mp4" duration="30">
            <Video codec="h264"
                   bitRate="1000000"
                   width="320"
                   height="240"
                   frameRate="30" />
            <Audio codec="aac"
                   bitRate="256000"
                   sampleRate="48000"
                   channels="2" />
        </EncoderProfile>
        <EncoderProfile quality="timelapsecif" fileFormat="mp4" duration="30">
            <Video codec="h264"
                   bitRate="1250000"
                   width="352"
                   height="288"
                   frameRate="30" />
            <Audio codec="aac"
                   bitRate="256000"
                   sampleRate="48000"
                   channels="2" />
        </EncoderProfile>
        <EncoderProfile quality="timelapse480p" fileFormat="mp4" duration="30">
            <Video codec="h264"
                   bitRate="4500000"
                   width="640"
                   height="480"
                   frameRate="30" />
            <Audio codec="aac"
                   bitRate="256000"
                   sampleRate="48000"
                   channels="2" />
        </EncoderProfile>
        <EncoderProfile quality="timelapse720p" fileFormat="mp4" duration="30">
            <Video codec="h264"
                   bitRate="9000000"
                   width="1280"
                   height="720"
                   frameRate="30" />
            <Audio codec="aac"
                   bitRate="256000"
                   sampleRate="48000"
                   channels="2" />
        </EncoderProfile>
        <EncoderProfile quality="timelapse1080p" fileFormat="mp4" duration="30">
            <Video codec="h264"
                   bitRate="35000000"
                   width="1920"
                   height="1080"
                   frameRate="30" />
            <Audio codec="aac"
                   bitRate="256000"
                   sampleRate="48000"
                   channels="2" />
        </EncoderProfile>
        <ImageEncoding quality="95" />
        <ImageEncoding quality="80" />
        <ImageEncoding quality="70" />
        <ImageDecoding memCap="20000000" />
    </CamcorderProfiles>
    <CamcorderProfiles cameraId="2">
        <EncoderProfile quality="low" fileFormat="mp4" duration="30">
            <Video codec="h264"
                   bitRate="192000"
                   width="176"
                   height="144"
                   frameRate="20" />
            <Audio codec="aac"
                   bitRate="256000"
                   sampleRate="48000"
                   channels="2" />
        </EncoderProfile>
        <EncoderProfile quality="high" fileFormat="mp4" duration="30">
            <Video codec="h264"
                   bitRate="20000000"
                   width="1920"
                   height="1080"
                   frameRate="30" />
            <Audio codec="aac"
                   bitRate="256000"
                   sampleRate="48000"
                   channels="2" />
        </EncoderProfile>
        <EncoderProfile quality="qcif" fileFormat="mp4" duration="30">
            <Video codec="h264"
                   bitRate="192000"
                   width="176"
                   height="144"
                   frameRate="20" />
            <Audio codec="aac"
                   bitRate="256000"
                   sampleRate="48000"
                   channels="2" />
        </EncoderProfile>
        <EncoderProfile quality="qvga" fileFormat="mp4" duration="30">
            <Video codec="h264"
                   bitRate="1000000"
                   width="320"
                   height="240"
                   frameRate="30" />
            <Audio codec="aac"
                   bitRate="256000"
                   sampleRate="48000"
                   channels="2" />
        </EncoderProfile>
        <EncoderProfile quality="cif" fileFormat="mp4" duration="30">
            <Video codec="h264"
                   bitRate="1250000"
                   width="352"
                   height="288"
                   frameRate="30" />
            <Audio codec="aac"
                   bitRate="256000"
                   sampleRate="48000"
                   channels="2" />
        </EncoderProfile>
        <EncoderProfile quality="480p" fileFormat="mp4" duration="30">
            <Video codec="h264"
                   bitRate="4500000"
                   width="640"
                   height="480"
                   frameRate="30" />
            <Audio codec="aac"
                   bitRate="256000"
                   sampleRate="48000"
                   channels="2" />
        </EncoderProfile>
        <EncoderProfile quality="720p" fileFormat="mp4" duration="30">
            <Video codec="h264"
                   bitRate="9000000"
                   width="1280"
                   height="720"
                   frameRate="30" />
            <Audio codec="aac"
                   bitRate="256000"
                   sampleRate="48000"
                   channels="2" />
        </EncoderProfile>
        <EncoderProfile quality="1080p" fileFormat="mp4" duration="30">
            <Video codec="h264"
                   bitRate="20000000"
                   width="1920"
                   height="1080"
                   frameRate="30" />
            <Audio codec="aac"
                   bitRate="256000"
                   sampleRate="48000"
                   channels="2" />
        </EncoderProfile>
        <EncoderProfile quality="2160p" fileFormat="mp4" duration="30">
            <Video codec="h264"
                   bitRate="50000000"
                   width="3840"
                   height="2160"
                   frameRate="30" />
            <Audio codec="aac"
                   bitRate="256000"
                   sampleRate="48000"
                   channels="2" />
        </EncoderProfile>
        <EncoderProfile quality="timelapselow" fileFormat="mp4" duration="30">
            <Video codec="h264"
                   bitRate="1000000"
                   width="176"
                   height="144"
                   frameRate="20" />
            <Audio codec="aac"
                   bitRate="128000"
                   sampleRate="48000"
                   channels="2" />
        </EncoderProfile>
        <EncoderProfile quality="timelapsehigh" fileFormat="mp4" duration="30">
            <Video codec="h264"
                   bitRate="50000000"
                   width="3840"
                   height="2160"
                   frameRate="30" />
            <Audio codec="aac"
                   bitRate="256000"
                   sampleRate="48000"
                   channels="2" />
        </EncoderProfile>
        <EncoderProfile quality="timelapseqcif" fileFormat="mp4" duration="30">
            <Video codec="h264"
                   bitRate="1000000"
                   width="176"
                   height="144"
                   frameRate="20" />
            <Audio codec="aac"
                   bitRate="128000"
                   sampleRate="48000"
                   channels="2" />
        </EncoderProfile>
        <EncoderProfile quality="timelapseqvga" fileFormat="mp4" duration="30">
            <Video codec="h264"
                   bitRate="1000000"
                   width="320"
                   height="240"
                   frameRate="30" />
            <Audio codec="aac"
                   bitRate="256000"
                   sampleRate="48000"
                   channels="2" />
        </EncoderProfile>
        <EncoderProfile quality="timelapsecif" fileFormat="mp4" duration="30">
            <Video codec="h264"
                   bitRate="1250000"
                   width="352"
                   height="288"
                   frameRate="30" />
            <Audio codec="aac"
                   bitRate="256000"
                   sampleRate="48000"
                   channels="2" />
        </EncoderProfile>
        <EncoderProfile quality="timelapse480p" fileFormat="mp4" duration="30">
            <Video codec="h264"
                   bitRate="4500000"
                   width="640"
                   height="480"
                   frameRate="30" />
            <Audio codec="aac"
                   bitRate="256000"
                   sampleRate="48000"
                   channels="2" />
        </EncoderProfile>
        <EncoderProfile quality="timelapse720p" fileFormat="mp4" duration="30">
            <Video codec="h264"
                   bitRate="9000000"
                   width="1280"
                   height="720"
                   frameRate="30" />
            <Audio codec="aac"
                   bitRate="256000"
                   sampleRate="48000"
                   channels="2" />
        </EncoderProfile>
        <EncoderProfile quality="timelapse1080p" fileFormat="mp4" duration="30">
            <Video codec="h264"
                   bitRate="20000000"
                   width="1920"
                   height="1080"
                   frameRate="30" />
            <Audio codec="aac"
                   bitRate="256000"
                   sampleRate="48000"
                   channels="2" />
        </EncoderProfile>
        <EncoderProfile quality="timelapse2160p" fileFormat="mp4" duration="30">
            <Video codec="h264"
                   bitRate="50000000"
                   width="3840"
                   height="2160"
                   frameRate="30" />
            <Audio codec="aac"
                   bitRate="256000"
                   sampleRate="48000"
                   channels="2" />
        </EncoderProfile>
        <EncoderProfile quality="timelapsehigh" fileFormat="mp4" duration="30">
            <Video codec="h264"
                   bitRate="50000000"
                   width="3840"
                   height="2160"
                   frameRate="30" />
            <Audio codec="aac"
                   bitRate="256000"
                   sampleRate="48000"
                   channels="2" />
        </EncoderProfile>
        <EncoderProfile quality="highspeedlow" fileFormat="mp4" duration="30">
            <Video codec="h264"
                   bitRate="9000000"
                   width="1280"
                   height="720"
                   frameRate="120" />
            <Audio codec="aac"
                   bitRate="256000"
                   sampleRate="48000"
                   channels="2" />
        </EncoderProfile>
        <EncoderProfile quality="highspeed720p" fileFormat="mp4" duration="30">
            <Video codec="h264"
                   bitRate="9000000"
                   width="1280"
                   height="720"
                   frameRate="120" />
            <Audio codec="aac"
                   bitRate="256000"
                   sampleRate="48000"
                   channels="2" />
        </EncoderProfile>
        <EncoderProfile quality="highspeed1080p" fileFormat="mp4" duration="30">
            <Video codec="h264"
                   bitRate="17000000"
                   width="1920"
                   height="1080"
                   frameRate="240" />
            <Audio codec="aac"
                   bitRate="256000"
                   sampleRate="48000"
                   channels="2" />
        </EncoderProfile>
        <EncoderProfile quality="highspeedhigh" fileFormat="mp4" duration="30">
            <Video codec="h264"
                   bitRate="17000000"
                   width="1920"
                   height="1080"
                   frameRate="240" />
            <Audio codec="aac"
                   bitRate="256000"
                   sampleRate="48000"
                   channels="2" />
        </EncoderProfile>
        <ImageEncoding quality="95" />
        <ImageEncoding quality="80" />
        <ImageEncoding quality="70" />
        <ImageDecoding memCap="20000000" />
    </CamcorderProfiles>
    <CamcorderProfiles cameraId="3">
        <EncoderProfile quality="low" fileFormat="mp4" duration="30">